{
  "$schema": "http://json-schema.org/draft-07/schema#",
  "title": "Orchestrator Manifest",
  "description": "Declares what resources this RPA project needs in UiPath Orchestrator. Place as orchestrator-manifest.json in your project root.",
  "type": "object",
  "required": ["project"],
  "properties": {
    "project": {
      "type": "string",
      "description": "Project name — used for logging and correlation."
    },
    "folderPath": {
      "type": "string",
      "description": "Orchestrator folder path (e.g. 'Finance/Invoicing'). Created automatically if it does not exist."
    },
    "assets": {
      "type": "array",
      "description": "Assets to sync. Missing assets are created; changed assets are updated; assets not listed here are removed from Orchestrator.",
      "items": {
        "type": "object",
        "required": ["name", "type"],
        "properties": {
          "name": { "type": "string" },
          "type": { "type": "string", "enum": ["text", "bool", "integer", "credential"] },
          "value": { "description": "Value for text/bool/integer assets." },
          "description": { "type": "string" },
          "perEnvironment": {
            "type": "object",
            "description": "Per-tenant overrides. Keys are tenant names (dev/test/stage/prod).",
            "additionalProperties": {}
          }
        }
      }
    },
    "queues": {
      "type": "array",
      "description": "Queue definitions to ensure exist.",
      "items": {
        "type": "object",
        "required": ["name"],
        "properties": {
          "name": { "type": "string" },
          "description": { "type": "string" },
          "maxRetries": { "type": "integer", "default": 0 },
          "autoRetry": { "type": "boolean", "default": false },
          "uniqueReference": { "type": "boolean", "default": false },
          "encrypted": { "type": "boolean", "default": false }
        }
      }
    },
    "buckets": {
      "type": "array",
      "description": "Storage buckets to ensure exist.",
      "items": {
        "type": "object",
        "required": ["name"],
        "properties": {
          "name": { "type": "string" },
          "description": { "type": "string" }
        }
      }
    },
    "packages": {
      "type": "array",
      "description": "NuGet packages (.nupkg) to upload. Glob patterns are supported for the path field.",
      "items": {
        "type": "object",
        "required": ["path"],
        "properties": {
          "path": {
            "type": "string",
            "description": "Relative path or glob pattern to the .nupkg file (e.g. 'output/*.nupkg')."
          },
          "autoVersion": {
            "type": "boolean",
            "default": true,
            "description": "If true, automatically appends a -cicd.N suffix when the version already exists in Orchestrator."
          }
        }
      }
    },
    "libraries": {
      "type": "array",
      "description": "Library packages (.nupkg) to upload to the tenant library feed.",
      "items": {
        "type": "object",
        "required": ["path"],
        "properties": {
          "path": {
            "type": "string",
            "description": "Relative path or glob pattern to the library .nupkg file."
          },
          "autoVersion": {
            "type": "boolean",
            "default": true
          }
        }
      }
    },
    "processes": {
      "type": "array",
      "description": "Process (Release) definitions to create or update in Orchestrator.",
      "items": {
        "type": "object",
        "required": ["name", "packageId"],
        "properties": {
          "name": { "type": "string", "description": "Display name of the process." },
          "packageId": { "type": "string", "description": "The NuGet package ID this process runs." },
          "description": { "type": "string" }
        }
      }
    },
    "credentials": {
      "type": "object",
      "description": "(v2 placeholder) AWS Secrets Manager configuration for credential storage and expiration monitoring. Not yet implemented.",
      "properties": {
        "source": {
          "type": "string",
          "enum": ["manual", "aws_secrets_manager"],
          "default": "manual",
          "description": "Where credentials are stored. 'manual' = entered via platform UI. 'aws_secrets_manager' = fetched from AWS (v2)."
        },
        "awsRegion": { "type": "string", "description": "(v2) AWS region for Secrets Manager." },
        "expirationAlerts": {
          "type": "object",
          "description": "(v2) Expiration alert configuration.",
          "properties": {
            "enabled": { "type": "boolean", "default": false },
            "alertAtDays": {
              "type": "array",
              "items": { "type": "integer" },
              "default": [30, 7],
              "description": "Days before expiry to send alerts (default: 30 and 7)."
            }
          }
        }
      }
    },
    "jira": {
      "type": "object",
      "description": "(v2 placeholder) Jira integration for automated ticketing on commits and deployments. Not yet implemented.",
      "properties": {
        "enabled": { "type": "boolean", "default": false },
        "projectKey": { "type": "string", "description": "(v2) Jira project key (e.g. 'RPA')." },
        "issueType": {
          "type": "string",
          "enum": ["Story", "Task", "Sub-task", "Bug"],
          "default": "Task",
          "description": "(v2) Default issue type for auto-created tickets."
        },
        "labels": {
          "type": "array",
          "items": { "type": "string" },
          "description": "(v2) Labels to add to auto-created tickets."
        },
        "createOn": {
          "type": "string",
          "enum": ["commit", "pr", "deployment"],
          "default": "deployment",
          "description": "(v2) When to create tickets: per commit, per PR, or per deployment."
        }
      }
    }
  }
}
